,node_id,name,alias,concept_class,prop_id,definition_text
524,25582,figure ground segregation,,ctp_C1,trm_4a3fd79d0b9dd,Discriminating objects from their surroundings by the visual system.
525,25583,gustation processing,gustation,ctp_C1,trm_4a3fd79d0b9e9,Form of chemoreception that facilitates taste perception.
526,25584,memory retrieval,,ctp_C5,trm_4a3fd79d0ba01,the process of accessing a stored memory
527,25585,active maintenance,,ctp_C4,trm_4a3fd79d0ba0d,The maintenance of information in working memory through active (volitional) rather than passive means
528,25586,articulatory loop,phonological loop,ctp_C5,trm_4a3fd79d0ba19,"one of the subsystems postulated in Alan Baddeleyâs multicomponent model of WORKING MEMORY, specialized for the temporary storage of verbal information.  It consists of a phonological store and an articulatory rehearsal process. The phonological store can hold speech-based information, subject to a rapid decay. The articulatory rehearsal process can refresh the decaying representation by reading it off and feeding it back to the store. It also serves to convert visually presented information (such as written words) into phonological codes and register them into the phonological store. "
529,25587,central executive,,ctp_C4,trm_4a3fd79d0ba25,"Theoretical &#39;top-down&#39; cognitive system responsible for the management of executive functions including planning, working memory, attention, problem solving, reasoning, inhibition, multi-tasking, and the initiation and monitoring of actions."
530,25588,maintenance,,ctp_C4,trm_4a3fd79d0ba30,The process of keeping information in active and immediately accessible state.
531,25589,manipulation,,ctp_C4,trm_4a3fd79d0ba3c,performance of operations upon information held in working memory
532,25590,phonological loop,,ctp_C5,trm_4a3fd79d0ba48,deals with sound or phonological information and consists of two parts: a short-term phonological store with auditory  memory traces that are subject to rapid decay and an articulatory rehearsal component that can revive the memory traces. 
533,25591,rehearsal,,ctp_C5,trm_4a3fd79d0ba54,The repetition of information in an attempt to maintain it longer in memory.
534,25592,rehearsal loop,,ctp_C5,trm_4a3fd79d0ba60,"or phonological loop, also called the phonetic loop or the articulatory loop, is the part of working memory that rehearses verbal information. It consists of two parts: a short-term phonological store with auditory memory traces that are subject to rapid decay and an articulatory rehearsal component that can revive the memory traces.The first component is a phonological memory store which can hold traces of acoustic or speech based material. Material in this short term store lasts about two seconds unless it is maintained through the use of the second subcomponent, articulatory subvocal rehearsal. Prevention of articulatory rehearsal results in very rapid forgetting (a process known as decay). "
535,25593,working memory retrieval,,ctp_C4,trm_4a3fd79d0ba6c,The process of accessing information that is maintained in working memory; the sub-process by which the contents of working memory are accessed.
536,25594,working memory storage,,ctp_C4,trm_4a3fd79d0ba77,The maintenance of information of working memory; a sub-component of working memory that allows for contents of working memory to be retained.
537,25595,test term,,,trm_4a7b128b8b2d0,None
538,25596,cognitive control,"executive control, executive function",ctp_C4,trm_4aae62e4ad209,The top-down modulation of cognitive processes based on higher-order representations such as goals or plans.
539,25597,echoic memory,,ctp_C5,trm_4b185801de7a1,refers to the phenomenon in which there is a brief mental echo that continues to sound after an auditory stimulus has been heard.
540,25598,reward processing,"reinforcement, reward",ctp_C5,trm_4b6525253c63f,A positive return for performance of a specific behavior.
541,25599,pain,,ctp_C8,trm_4b65259eeee34,An unpleasant sensory and emotional experience associated with actual or potential tissue damage.
542,25600,joint attention,mutual knowledge,ctp_C2,trm_4b75ed06c917d,the process of alerting one person to a stimulus through nonverbal cues such as finger pointing or gazing. It is one of the first signs of the development of a theory of mind in babies and serves as an important step to later language and social development.
543,25601,behavioral inhibition (cognitive),,ctp_C4,trm_4b7c270940f9d,"Often used as a synonym of &#34;response inhibition&#34; to describe the inhibition of actions.
"
544,25602,behavioral inhibition (temperament),,,trm_4b7c27094a093,A temperamental characteristic described by shyness and social anxiety.
545,25603,central coherence,,,trm_4b82c75498408,"a person&#39;s ability to understand things in context, frequently described as a deficit in literature on autism"
546,25604,interference resolution,interference control,ctp_C4,trm_4c3e04d656f06,The process of selecting information with regard to its relevance to an ongoing task and suppressing the processing of irrelevant information.
547,25605,updating,,ctp_C4,trm_4c3e05903e4bb,The revision or refreshing of information that is maintained in working memory
548,25606,task set,,ctp_C4,trm_4c3e0646a2408,The set of rules and/or stimulus-response mappings that define how a task should be performed.
549,25607,subconscious,,,trm_4d21e9a7dd8ca,"Subconscious is any neural activity which has the potential to be conscious, but at the moment is processed below the level of consciousness.

In contrast to unconscious information processing, subconscious processing contains meaning (semantic information).

Intuition is a good example for subconscious information processing. In other words, intuition means thinking below the level of consciousness whereby only the output enters the stream of consciousness.

from Peter Walla"
550,25608,semantic information,semantic knowledge,,trm_4d2201d530697,"information that is not tied to any specific object, event, domain, or application. It includes general factual information about the world (as in an encyclopedia) and oneself."
551,25609,paraphasia,,ctp_C6,trm_4d7fa1a3e2a10,"generally refers to errors in naming. Collectively, this term is applied to any unintended error of word or sound choice.
"
552,25610,phonemic paraphasia,,ctp_C6,trm_4d7fa1ee2f870,"is the production of unintended sounds or syllables in the utterance of partially recognizable word, e.g., âpakerâ for âpaper.â
"
553,25611,neologism,,ctp_C6,trm_4d7fa2df05f23,"is the production of nonsense word or words, usually without recognition of errors, e.g., âtableâ becomes âtilto.â

"
554,25612,metacomprehension,,,trm_4d7fc763cf777,"refers to the learners&#39; ability to monitor the degree to which they understand information being communicated to them, to recognize failures to comprehend, and to employ repair strategies when failures are identified.
"
555,25613,conceptual metaphor,,,trm_4d920c905d465,"In cognitive linguistics, metaphor is defined as understanding one conceptual domain in terms of another conceptual domain; for example, using one person&#39;s life experience to understand a different person&#39;s experience. A conceptual domain can be any coherent organization of experience.

"
556,25614,body representation,,,trm_4e5505361f160,A mental representation of one&#39;s own body
557,25615,delusion,,,trm_4fa3afaeef512,A belief held despite appreciable external evidence to the contrary.
558,25616,deliberation,consideration,ctp_C3,trm_4fa28299dbddd,"the process of judging the merits of multiple options, which may then be followed by choice."
559,25617,thought,,,trm_4fa295124a375,"Subjectively salient cognitive processing, at least part of which may be reportable."
560,25618,multisensory integration,,ctp_C1,trm_4e31ced566649,The process by which unisensory signals are combined to form a new product. It is operationally defined as a multisensory response (neural or behavioral) that is significantly different from the responses evoked by the modality-specific component stimuli
561,25619,crossmodal,cross-modal,,trm_4e31d2241319f,A complex of two or more modality-specific [unimodal] stimuli
562,25620,unisensory,,ctp_C1,trm_4e31d365bc7e2,Describes any sensory process associated with a single sensory modality 
563,25621,multisensory,,ctp_C1,trm_4e31d3ba7d25b,a process associated with multiple sensory modalities 
564,25622,synchrony perception,,ctp_C1,trm_4e31e6dca01ca,"the process of perceiving whether or not the crossmodal cues (e.g., audio and visual) to an event (e.g., audiovisual speech) are in temporal synchrony with each other."
565,25623,tactile working memory,,ctp_C5,trm_4e416f1373936,working memory for tactile information
566,25624,interoceptive representation,,,trm_4e5506161998c,A representation of the internal state of the body
567,25625,sense of ownership,,,trm_4e5badf095692,The feeling that something is part of one self.
568,25626,sense of body ownership,,,trm_4e5faabfe8ce3,The feeling that something is part of one&#39;s own body.
569,25627,pain sensitization ,,ctp_C8,trm_4e61264db33d4,A painful stimulus is perceived more painful over the time course of stimulation.
570,25628,pain habituation,pain adaptation,ctp_C8,trm_4e6127bd91be9,A painful stimulus is perceived less painful over the time course of stimulation.
571,25629,priming,,ctp_C5,trm_4e89aebaa311d,Priming is the effect of prior exposure to a somehow (e.g. perceptually or semantically) related stimulus on the response to a subsequent stimulus. This effect may be positive and facilitatory (e.g. naming of an object is typically faster when that object has already been recently named) or negative and detrimental (e.g. slower response to a previously ignored stimulus).
572,25630,expectancy,"expectation, reward prediction error",ctp_C10,trm_4ebfe9a465449,"A belief about something in the future. Sometimes requires explicit, conscious awareness, distinct from unconscious, conditioning-based learning."
573,25631,self control,"Self-regulation, willpower, ego strength, self-discipline",ctp_C4,trm_4ee8facd77dfc,"The effortful control of behaviors, thoughts, or emotions with the aim of increasing the likelihood of attaining long-term over short-term outcomes."
574,25632,embodied cognition,,,trm_4f33e65d0daac,a theory emphasizing the essentiality of the body&#39;s interaction with the environment to cognition
575,25633,resource,,,trm_4f3a72a028d90,"any aspect of cognition having bounded availability, eg. memory, attention"
576,25634,curiosity,inquisitiveness,ctp_C10,trm_4f3bdeedcc99d,"wanting knowledge or understanding, often of a novel or unfamiliar entity  "
577,25635,visual awareness,,,trm_4ff36d79c26c6,"the subjective experience of seeing, emerging about 200ms after the onset of a visual stimulus; it is contrasted with unconscious visual perception"
578,25636,imagination,"envisagement, representation, mental conception",,trm_4f4511e519b53,forming mental images or concepts of what is not actually present to the senses 
579,25637,addiction,dependency,,trm_4fafd1626bf2b,"A phenomenon sometimes conflated and sometimes contrasted with dependency, in which a person has transitioned from liking a rewarding substance or behavior to requiring it."
580,25638,self talk,,,trm_4f4672db34a46,"overt verbalisation of thoughts for the purpose of self motivation, problem solving, reasoning, learning or stress management; a behavior commonly witnessed in sports-people during moments of performance pressure "
581,25639,worldview,perspective,,trm_4f46753b8be4f,"overarching subjective account of environmental (ie. that in which an agent is situated) characteristics and functions, applicable across local and global spatiotemporal scales; a framework of ego-centric ideas and beliefs that serves to guide decision making and action, and to generate, sustain, and apply knowledge. "
582,25640,inattentional blindness,perceptual blindness,,trm_4fe3861edc919,a phenomenon in which people fail to see an unexpected stimulus
583,25641,interoception,,,trm_4fe39e4388409,"perception of stimuli inside the body, e.g. hunger, thirst, pain"
584,25642,extinction,,,trm_4fe8edc62f613,"the phenomenon by which a response to a conditional stimulus presented in absence of the unconditional stimulus diminishes over time; rather than a forgetting, it is generally believed to be a new learning."
585,25643,difference threshold,"just noticeable difference, JND",,trm_4fe9fae4321e7,the smallest detectable difference between two stimuli
586,25644,binocular depth cue,,,trm_4fea04a02ce37,a cue that provides depth information about a scene when it is viewed with both eyes
587,25645,color constancy,,,trm_4fea09fac5316,"the ability to assign stable colors despite variation in light, i.e. identifying that a given box is orange irrespective of the spectral composition or intensity of the light illuminating it"
588,25646,feature search,,,trm_4fea18ec76bc9,search for a target according to a single feature (e.g. color)
589,25647,attentional blink,AB,ctp_C2,trm_4fea1aeaa7b17,a phenomenon in which the participant is unable to detect a second salient visual stimulus if presented at the same spatial location within 200-500 milliseconds after the first
590,25648,change blindness,,,trm_4fea238758d33,"the inability to detect changes to an object or a scene even if large, repeatedly made, or anticipated; it can even occur when the subject is fixated on the item being changed."
591,25649,motion aftereffect,,,trm_4fea25630ffb5,the illusion of movement in a stationary object after prolonged viewing of a moving object
592,25650,overt attention,,,trm_4feb3f8c551cb,directing a sense organ at a stimulus source
593,25651,covert attention,,,trm_4feb3ffa1ab51,the act of focusing on one of several sensory stimuli
594,25652,unconscious perception,,,trm_4feb44e5ae25b,"the process of perceiving a stimulus without being conscious of having seen it, measurable by electrophysiological response at the time and by recognition testing later"
595,25653,autonoesis,autonoetic consciousness,,trm_4ff1fc04e22e8,"consciousness of self consistent over time, both in imagining the future and recalling the past; consciousness of subjectivity"
596,25654,psychological refractory period,PRP,,trm_4ffca95528c88,"the phenomenon by which people are unable to make more than one conscious decision (and, by extension, unable to complete more than one task) within a few hundred milliseconds"
597,25655,noesis,noetic consciousness,,trm_4ffdc96dc85b7,a consciousness characterized by knowing or familiarity without self-reference (contrast with autonoesis)
598,25656,impulsivity,impulsiveness,,trm_50070dce14554,the tendency to act without adequately assessing context
599,25657,binocular rivalry,,,trm_500d8626d0770,"competition between the eyes for control of perception, particularly evident when different stimuli are presented to each eye"
600,25658,cone of confusion,,,trm_500d8839c2877,a region around the head for which neither interaural time differences (ITDs) nor interaural loudness differences (ILDs) in a sound are not great enough for a person to localize the sound source
601,25659,vection,,,trm_500d8aef38f2c,the illusion of movement in a stationary person caused by moving visual cues
602,25660,visual acuity,,,trm_500d8bcf5f29a,a measure of the finest resolution perceivable by the eyes
603,25661,visual angle,,,trm_500d8c8fcc520,"the angle a viewed object subtends at the eye, usually stated in degrees of arc, and is a function of the size of the object and its distance from the eye"
604,25662,domain specificity,,,trm_5021684cba96c,"the idea in cognitive science that the mind is divided according to the content of information being processed into specialized, possibly evolved, modules"
605,25663,global precedence,,,trm_5021873f37abc,"the idea that, all else held equal, global features are perceived earlier than are local features of a given stimulus"
606,25664,anxiety,,ctp_C8,trm_5022ef7599294,"An aversive psychophysiological state characterized by fear, worry, or concern associated with current or impending threat often elicited by general and specific interoceptive or exteroceptive cues."
607,25665,spontaneous recovery,recovery,ctp_C5,trm_5024002a85b1f,"recovery of a conditioned response following extinction, simply as a function of time"
608,25666,reinstatement,,,trm_502403240a2a2,"following extinction, conditioned response returns after exposure to unconditional stimulus (US) alone"
609,25667,blindsight,blind sight,,trm_5029515e29f7f,"unconscious visual perception, i.e. a phenomenon in which people can detect, discriminate between, and respond to visual stimuli without being consciously aware of them"
610,25668,feature integration,,,trm_502954662d63e,how different features of a percept are bound into a conscious whole
611,25669,transduction,,,trm_50297454e516b,in which information from stimuli is transduced into signals to the brain
612,25670,phototransduction,,,trm_5029751d118c4,in which energy from visual stimuli is transduced into a signal in the retina to the brain
613,25671,border ownership,,,trm_502ab8dd991bf,the determination of a local feature (i.e. a contrast edge or line) and the object to which it belongs
614,25672,multistable perception,,,trm_502abeab4e1d8,"conflicting sensory input results in spontaneous, sometimes controllable, experiences thereof"
615,25673,visual orientation,,,trm_502ad54c11389,use of visual stimulus information in perceiving orientation thereof or of the self
616,25674,lateral masking,,,trm_502bdc6bdaa2b,"perceptual phenomenon in which one stimulus attenuates signals generated by another, adjacent, stimulus presented simultaneously"
617,25675,crowding,,,trm_502c139d5ed78,target stimulus is made harder to identify when surrounded by similar non-target stimuli
618,25676,lexeme,,,trm_502c343d20523,the phonological form of a given lexical item being retrieved
619,25677,trait anxiety,,,trm_50aff037c389f,"a hyper-responsive system for threat detection, differentiated from state anxiety in duration and cause"
620,25678,strength,,,trm_50eb5469ba37a,Strength refers to a muscle&#39;s ability to generate force against physical objects.
621,25679,balance,,,trm_50eb56a7867db,"Balance allows humans to be able to orient the body in space, maintain an upright posture under static and dynamic conditions, and move without falling, by adjusting motoric control"
622,25680,locomotion,,,trm_50eb692db57eb,"Locomotion is the act of moving the body from one place to another. It requires input from the brain, spinal cord, peripheral nerves, muscular power and joint and cardiovascular health.  "
623,25681,vestibular control,,,trm_50f382d7abdff,"The vestibular system transduces and processes angular and linear acceleration and deceleration of the head, enabling postural balance, locomotor control, and gaze stabilization, particularly during head movement. The vestibular system is an integral component of our sensory experience and sensory-motor function. Healthy peripheral and central vestibular anatomy is essential for functionally relevant gaze stability during head motion and postural control."
624,25682,life satisfaction,,,trm_50f3c0af04e37,"Oneâs cognitive evaluation of life experiences; this measure is concerned with whether people like their lives or not. Life satisfaction includes both general (e.g., my life is going well) and domain-specific (e.g., I am satisfied with my family life) aspects. "
625,25683,attentional bias,Attention bias,,trm_510059e54b2cf,Attentional bias refers to the tendency for a particular class of stimuli to capture attention. The term is most typically used to refer to biases related to emotional content in bottom-up-capture attention tasks. 
626,25684,reception of facial communication,,ctp_C9,trm_5154a9f45903f,"The capacity to perceive someoneâs emotional state non-verbally based on facial expressions. Examples include affect recognition, facial recognition and characterization."
627,25685,productive facial communication,,,trm_5154aa9735134,"The capacity to convey oneâs emotional state non-verbally via facial expressions, including eye contact, expressive reciprocation, and gaze following."
628,25686,Reception of non-facial communication,,,trm_5154b049c279f,"The capacity to perceive social and emotional information based on modalities other than facial expression, including non-verbal gestures, affective prosody, distress calling, cooing, etc."
629,25687,Production of non-facial communication,,,trm_5154b23a3156a,"The capacity to express social and emotional information based on modalities other than facial expression, including non-verbal gestures, affective prosody, distress calling, cooing, etc."
630,25688,agency,,,trm_5154b2f947fe9,"The ability to recognize oneâs self as the agent of oneâs actions and thoughts, including the recognition of oneâs own body/body parts."
631,25689,self knowledge,,,trm_5154b39a3193d,"The ability to make judgments about oneâs current cognitive or emotional internal states, traits, and/or abilities."
632,25690,animacy perception,,ctp_C1,trm_5159beaf80413,"The ability to appropriately perceive that another entity is an agent (i.e., has a face, interacts contingently, and exhibits biological motion)."
633,25691,action perception,,,trm_5159c00c3dac3,The ability to perceive the purpose of an action being performed by an animate entity.
634,25692,understanding mental states,,,trm_5159c0a633cda,"The ability to make judgments and/or attributions about the mental state of other animate entities that allows one to predict or interpret their behaviors. Mental state refers to intentions, beliefs, desires, and emotions."
635,25693,circadian rhythm,,,trm_5159c382bd8d4,"Endogenous, self-sustaining oscillations that organize the timing of biological systems to optimize physiology, behavior, and health. Circadian rhythms are synchronized by recurring environmental cues and attempt to anticipate the external environment. They also modulate homeostasis within the brain and other systems, tissues, and organs. "
636,25694,sleep,,,trm_5159c70d0e98e,"Sleep and wakefulness are endogenous, recurring, behavioral states that reflect coordinated changes in the dynamic functional organization of the brain and that optimize physiology, behavior, and health. Homeostatic and circadian processes regulate the propensity for wakefulness and sleep. Sleep is a reversible state, characterized by postural recumbence, behavioral quiescence, and reduced responsiveness. It involves predictable cycling of non-rapid eye movement (NREM) and rapid eye movement (REM). It is affected by experiences during wakefulness, and has restorative and transformative effects that optimize neurobehavioral functions during wakefulness."
637,25695,loss,,,trm_5159c80c1dd24,"A state of deprivation of a motivationally significant con-specific, object, or situation. Loss may be social or non-social and may include permanent or sustained loss of shelter, behavioral control, status, loved ones, or relationships. The response to loss may be episodic (e.g., grief) or sustained."
638,25696,defensive aggression,,,trm_5159c885a7314,A response elicited by a real or perceived threat that leads to a pattern of behaviors directed at terminating the threat.
639,25697,offensive aggression,proactive aggression,,trm_5159c8a5d3d13,A response elicited by competition over resource acquisition or other positive consequences. This form of aggression often arises from differences in social status and dominance.
640,25698,reward valuation,,,trm_5159c94667677,"Processes by which the probability and benefits of a prospective outcome are computed and calibrated by reference to external information, social context (e.g., group input, counterfactual comparisons), and/or prior experience. This calibration is influenced by pre-existing biases, learning, memory, stimulus characteristics, and deprivation states. Reward valuation may involve the assignment of incentive salience to stimuli."
641,25699,effort valuation,willingness to work,,trm_5159c971bf444,Processes by which the cost(s) of obtaining an outcome is computed; tendency to overcome response costs to obtain a reinforcer.
642,25700,reward learning,,,trm_5159cb12a0f92,"A process by which organisms acquire information about stimuli, actions, and contexts that predict positive outcomes, and by which behavior is modified when a novel reward occurs or outcomes are better than expected. Reward learning is a type of reinforcement learning, and similar processes may be involved in learning related to negative reinforcement."
643,25701,semantic network,ontology,ctp_C6,trm_51838baad343e,Set of concepts and relations
644,25702,cognitive training,,,trm_51a6905a3f021,Targeted exercises designed to help improve mental capacities.
645,25703,emotion regulation,,,trm_51a690a7492eb,"The ability to have control over and change emotional responses, such as feelings and behaviors associated with them. "
646,25704,neuroplasticity,,,trm_51a690eeadcb7,The brain&#39;s ability to change in structure and function through experience.
647,25705,restricted behavior,"repetitive behavior, stereotyped behavior",,trm_52068e5bd9aa1,"A restricted behavior is a stereotyped pattern of behavior, activity, or interest. Examples include preoccupation with an object, activity, or topic, and this preoccupation is abnormal in intensity or focus.  Individuals with restricted behaviors may find it challenging to break away from habit or routine."
648,25706,social motivation,,,trm_52090251db8c8,An individual&#39;s tendency to seek out direct contact with another person or a group of people.
649,25707,irritability,"anger, agitation, moodiness, testy, grumpy, short tempered",,trm_523c7afe39f78,"The quality or state of being agitated, testy, grumpy, moody, or having a short temper."
