,node_id,name,alias,concept_class,prop_id,definition_text
263,25321,language production,,ctp_C6,trm_4a3fd79d0a78d,"is translating a concept or set of ideas into spoken, signed or written form"
264,25322,learning,,ctp_C5,trm_4a3fd79d0a7bb,The process of acquiring new skills/knowledge/information 
265,25323,lemma,,ctp_C6,trm_4a3fd79d0a7c7,"an abstract form of a word before any phonological assignment, arising early in speech production"
266,25324,lexical encoding,,ctp_C6,trm_4a3fd79d0a7d4,"converting vocabulary, words, or morphemes of a language into a code.
"
267,25325,lexical retrieval,,ctp_C6,trm_4a3fd79d0a7e0,retrieval of a lexical entry
268,25326,lexicon,vocabulary,ctp_C6,trm_4a3fd79d0a7ec,"The vocabulary of a language, including its words and expressions."
269,25327,linguistic competence,,ctp_C6,trm_4a3fd79d0a7f8,"a speaker&#39;s implicit, internalized knowledge of the rules of their language."
270,25328,listening,,,trm_4a3fd79d0a803,"to pay attention to sound; to hear something with thoughtful attention, give consideration; to be alert to catch an expected sound."
271,25329,logic,,ctp_C3,trm_4a3fd79d0a80f,a science that deals with the principles and criteria of validity of inference and demonstration; the science of the formal principles of reasoning.
272,25330,logical reasoning,,ctp_C3,trm_4a3fd79d0a81b,"The strategy when  one uses deduction, induction, or abduction to evaluate preconditions and rules to determnie a conclusion.  "
273,25331,long-term memory,LTM,ctp_C5,trm_4a3fd79d0a833,"a system for permanently storing, managing, and retrieving information for later use, items of information stored as long-term memory may be available for a lifetime."
274,25332,loss aversion,,ctp_C3,trm_4a3fd79d0a83f,The tendency of individuals to be more sensitive to the possibility of losing objects or money than they are to the possibility of gaining the same objects or amounts of money.
275,25333,lying,,ctp_C9,trm_4a3fd79d0a84a,the expression of a falsehood
276,25334,mathematical reasoning,,ctp_C3,trm_4a3fd79d0a862,Reasoning about mathematical objects
277,25335,meaning,,ctp_C6,trm_4a3fd79d0a86e,the connotation of a word or phrase
278,25336,mechanical reasoning,,ctp_C3,trm_4a3fd79d0a87a,Reasoning about mechanical objects or functions
279,25337,melody,tune,ctp_C1,trm_4a3fd79d0a886,a linear succession of musical tones which is perceived as a single entity.
280,25338,memory,,ctp_C5,trm_4a3fd79d0a891,"The ability of an organism to use past events to inform/influence current actions
"
281,25339,mental arithmetic,,ctp_C3,trm_4a3fd79d0a8ed,"mathematical calculations done mentally, without writing them down."
282,25340,mental imagery,,ctp_C1,trm_4a3fd79d0a8fc,"is an experience that, on most occasions, significantly resembles the experience of perceiving (through any of the senses) of some object, event, or scene, but occurs when the relevant object, event, or scene is not actually present to the senses."
283,25341,mental representation,,,trm_4a3fd79d0a908,a presentation to the mind in the form of an idea or image.
284,25342,mental rotation,,ctp_C1,trm_4a3fd79d0a914,Ability to rotate an object in one&#39;s mind; ability to make perceptual judgments on a new spatial configuration of an object.
285,25343,metacognition,,,trm_4a3fd79d0a920,awareness or analysis of one&#39;s own learning or thinking processes.
286,25344,metacognitive skill,,ctp_C5,trm_4a3fd79d0a92b,"a learners&#39; automatic awareness of their own knowledge and their ability to understand, control, and manipulate their own cognitive processes.
"
287,25345,metaphor,,ctp_C6,trm_4a3fd79d0a937,a figure of speech in which a word or phrase literally denoting one kind of object or idea is used in place of another to suggest a likeness or analogy between them.
288,25346,misattribution,,,trm_4a3fd79d0a943,attributing an event to something with which it has no connection or association.
289,25347,monitoring,,ctp_C4,trm_4a3fd79d0a94f,the act of checking for particular kinds of information
290,25348,mood,,ctp_C8,trm_4a3fd79d0a95a,a conscious state of mind or predominant emotion.
291,25349,motor control,,ctp_C7,trm_4a3fd79d0a972,The function of supervising motor activities
292,25350,motor learning,,ctp_C5,trm_4a3fd79d0a995,"the process of improving motor skills, the smoothness and accuracy of movements."
293,25351,motor planning,movement planning,ctp_C7,trm_4a3fd79d0a9a1,"the conception of a future motoric action
"
294,25352,motor program,,ctp_C7,trm_4a3fd79d0a9ad,abstract representation of a movement
295,25353,motor sequence learning,,ctp_C5,trm_4a3fd79d0a9b9,The acquisition of knowledge regarding sequences of motor action
296,25354,movement,,ctp_C7,trm_4a3fd79d0a9c4,change of place or position or posture
297,25355,naming,,ctp_C6,trm_4a3fd79d0a9dc,the expression of the name of an object
298,25356,narrative,,ctp_C6,trm_4a3fd79d0a9e8,"a story that is created in a constructive format (as a work of writing, speech, poetry, prose, pictures, song, motion pictures, video games, theater or dance) that describes a sequence of fictional or non-fictional events."
299,25357,navigation,,ctp_C1,trm_4a3fd79d0aa00,The process of controlling the movement of a body/entity/vehicle through space from one point to another.
300,25358,nociception,,ctp_C1,trm_4a3fd79d0aa0c,the processes of encoding and processing noxious stimuli.
301,25359,nondeclarative knowledge,,,trm_4a3fd79d0aa23,The nonconscious or implicit ability to express and practice learned information.
302,25360,nondeclarative memory,,ctp_C5,trm_4a3fd79d0aa2f,"Memory acquired through experience and which can not be consciously articulated (such as by recall or recognition). This type of memory includes priming, conditioning, skill-acquisition, and habits."
303,25361,novelty detection,,,trm_4a3fd79d0aa47,the identification of new or unknown information
304,25362,object categorization,,,trm_4a3fd79d0aa5e,the assignment of an object to a particular category
305,25363,object centered representation,,,trm_4a3fd79d0aa6a,"In an object-centered representation, the position of the subparts of an object are encoded with respect to a set of axes and an origin centered on the object. Several physiological and neuropsychological results support the existence of such representations in humans and monkeys. An explicit representation would involve neurons with invariant response properties in object-centered coordinates.
"
306,25364,object detection,,ctp_C1,trm_4a3fd79d0aa76,"deals with detecting instances of semantic objects of a certain class (such as humans, buildings, cars, etc.)."
307,25365,object manipulation,,ctp_C7,trm_4a3fd79d0aa8d,"is a form of dexterity play or performance in which one or more artists physically interact with props such as balls, hoops, rings, poi, staff, devil sticks, or clubs. Object manipulation can be considered an advanced combinatorial form of sports, dance, and games."
308,25366,object perception,,ctp_C1,trm_4a3fd79d0aaa4,"The process of transforming basic visual sensory input (such as contrast, edge, motion, color etc) into a more abstract and semantically identifiable whole."
309,25367,object recognition,object identification,ctp_C1,trm_4a3fd79d0aab0,"is the ability to perceive an objectâs physical properties (such as shape, colour and texture) and apply semantic attributes to the object, which includes the understanding of its use, previous experience with the object and how it relates to others.
"
310,25368,olfaction,,ctp_C1,trm_4a3fd79d0aabc,the sense of smell; the act or process of smelling.
311,25369,olfactory perception,,ctp_C1,trm_4a3fd79d0aac8,the sensation that results when olfactory receptors in the nose are stimulated by particular chemicals in gaseous form. 
312,25370,orthographic lexicon,,ctp_C6,trm_4a3fd79d0aad4,A set of representations of orthographic information
313,25371,parsing,,ctp_C6,trm_4a3fd79d0ab42,to resolve (as a sentence) into component parts of speech and describe them grammatically
314,25372,passive attention,,ctp_C2,trm_4a3fd79d0ab4d,"refers to the involuntary process directed by external events that stand out from their environment, such as a bright flash, a strong odor, or a sudden loud noise.
"
315,25373,past tense,,ctp_C6,trm_4a3fd79d0ab59,refers to a form of a verb that indicates that the action already has occurred 
316,25374,pattern recognition,,ctp_C1,trm_4a3fd79d0ab65,The process of identifying a meaningful pattern in raw data.
317,25375,pavlovian conditioning,"classical conditioning, respondent conditioning",ctp_C5,trm_4a3fd79d0ab70,"a form of learning in which a stimulus (designated the &#34;conditional stimulus&#34; or CS and being one without inherent significance) is paired with an unconditional stimulus or US, so named because it is biologically significant (e.g. food, sex, drug, pain), until the participant responds to the former in a way that conveys its association of the two. Importantly, participant response may be different between the US and its paired CS."
318,25376,perception,,ctp_C1,trm_4a3fd79d0ab7c,the conscious experience or mental registration of a sensory stimulus
319,25377,perceptual binding,,ctp_C1,trm_4a3fd79d0ab88,"is the cognitive ability to couple characteristics between items that one is perceiving.  This can be illustrated by the one observing a blue square and a yellow circle.  Through the neural mechanisms of perceptual binding, one can ensure that the sensing of blue is coupled to that of a square shape and that of yellow is coupled to that of a circle.
"
320,25378,perceptual categorization,,ctp_C1,trm_4a3fd79d0ab93,"A selective system that can have no a priori information about the particular stimuli that might be encountered in its environment, other than boundary conditions implicit in the construction of its recognizing elements. Perceptual categorization, according to this view, does not involve the &#34;reading in&#34; of readily available information about the stimulus category; rather, it involves the utilization of multiple cues in degenerate, overlapping sets and under the influence of context.  
"
321,25379,perceptual fluency,,ctp_C1,trm_4a3fd79d0ab9f,"is the ease at which the brain can process information.
"
322,25380,perceptual identification,,ctp_C1,trm_4a3fd79d0abaa,"has two different processing stages.  The first stage yields a state of of perceptual information about the stimulus presented.  The second stage is the processing of attained perceptual information in a response. 
"
323,25381,perceptual learning,,ctp_C5,trm_4a3fd79d0abb6,"long lasting improvement in performing perceptual  (visual, auditory, tactile, olfactory or taste) tasks as a function of experience."
324,25382,perceptual similarity,,ctp_C1,trm_4a3fd79d0abc1,"Perceptual similarity is the subjective similarity between two stimuli as perceived by the observer. Thus, object A may be rated as more similar to object B than to object C despite a greater difference in some physical metric (such as height or width) between objects A and C than between objects A and B. This may differ across modalities: for example, two objects may be rated as more similar when seen than when touched. However, the physical, objective similarity between the two objects remains the same regardless of which modality is used to explore them."
325,25383,perceptual skill,,ctp_C1,trm_4a3fd79d0abcd,The ability to observe and understand the events surrounding an individual.
326,25384,performance monitoring,,ctp_C4,trm_4a3fd79d0ac30,the online evaluation of one&#39;s performance on a task
327,25385,phonation,,ctp_C6,trm_4a3fd79d0ac4a,process by which the vocal folds produce certain sounds through quasi-periodic vibration; any oscillatory state of any part of the larynx that modifies the airstream.
328,25386,phonological buffer,,ctp_C6,trm_4a3fd79d0ac61,"a passive storage device that is part of the articulatory rehearsal loop; serves as a part of the mechanisms ordinarily needed for hearing.  In rehearsal, the buffer is loaded by means of subvocalization."
329,25387,phonological code,,,trm_4a3fd79d0ac7a,A representation of information using phonological features
330,25388,phonological encoding,,ctp_C6,trm_4a3fd79d0ac87,"involves retrieval of segmental and supra-segmental information and the generation of a syllabified phonological word, and the computation of the phonetic form of the intended utterance, referred to as phonetic encoding.

"
331,25389,phonological retrieval,,ctp_C6,trm_4a3fd79d0ac93,The retrieval of phonological representations based on other cues
332,25390,phonological working memory,,ctp_C4,trm_4a3fd79d0ac9e,The process of maintaining sound information online for a limited amount of time.
333,25391,planning,,ctp_C4,trm_4a3fd79d0acc1,"formulation, evaluation and selection of a sequence of actions to achieve a desired goal."
334,25392,pragmatic inference,,ctp_C3,trm_4a3fd79d0ad12,"Inferences are made when a person (or machine) goes beyond available evidence to form a conclusion. A pragmatic inference (also known as an inductive inference) is one which is likely to be true because of the state of the world. Unlike deductive inferences, pragmatic (inductive) inferences do yield conclusions that increase the semantic information over and above that found in the initial premises. "
335,25393,pragmatic knowledge,,,trm_4a3fd79d0ad1d,"is how individuals communicate meaning and how they produce contextually appropriate utterances, sentences, or texts.  Pragmatic knowledge includes sociolinguistic and functional knowledge.  "
336,25394,pragmatic reasoning,,ctp_C3,trm_4a3fd79d0ad29,"Pragmatic reasoning is defined as the process of finding the intended meaning(s) of the given, and it is suggested that this amounts to the process of inferring the appropriate context(s) in which to interpret the given."
337,25395,preattentive processing,,ctp_C2,trm_4a3fd79d0ad41,background activity that necessarily precedes conscious mental activity; major purpose is the preparation of sensory input for use in focal-attentive processes including encoding of the basic properties of sensory input.
338,25396,preconscious perception,,ctp_C1,trm_4a3fd79d0ad4c,"is the subthreshold process of visual perception. 

"
339,25397,prejudice,,,trm_4a3fd79d0ad64,"preconceived judgment or opinion; an adverse opinion or leaning formed without just grounds or before sufficient knowledge; an irrational attitude of hostility directed against an individual, a group, a race, or their supposed characteristics."
340,25398,primary memory,,ctp_C5,trm_4a3fd79d0ad94,the temporary maintenance system for conscious processing of information.
341,25399,proactive interference,,ctp_C5,trm_4a3fd79d0adab,"the forgetting of information due to interference from the traces of events or learning that occurred prior to the materials to be remembered; occurs when in any given context, past memories inhibit an individualâs full potential to retain new memories."
342,25400,problem solving,,ctp_C3,trm_4a3fd79d0adb7,"Broadly, the mental processes involved in finding a solution to a problem."
343,25401,procedural knowledge,,ctp_C5,trm_4a3fd79d0adc3,Knowledge exercised in the performance of a task/activity. Its acquisition or structure is often unavailable to the actor.
344,25402,procedural learning,,ctp_C5,trm_4a3fd79d0adcf,The acquisition of a skill or ability through practice which is not accessible to verbalization or conscious awareness.
345,25403,procedural memory,,,trm_4a3fd79d0addc,memory for how to do things; procedural memories are automatically retrieved and utilized for the execution of the step-by-step procedures involved in both cognitive and motor skills.
346,25404,procedural rule,,,trm_4a3fd79d0ade8,No definition submitted yet
347,25405,processing capacity,,,trm_4a3fd79d0adf4,No definition submitted yet
348,25406,processing stage,,,trm_4a3fd79d0ae00,A subset of mental operations that are confined some feature space of information within a stream and/or hierarchy of mental operations.
349,25407,pronunciation,,ctp_C6,trm_4a3fd79d0ae17,"the way a word or a language is spoken, or the manner in which someone utters a word."
350,25408,proper noun,,ctp_C6,trm_4a3fd79d0ae2b,"A subject that usually indicates a particular person, place, or object."
351,25409,proprioception,,ctp_C1,trm_4a3fd79d0ae3d,the sense of the relative position of neighboring parts of the body.
352,25410,prosodic stress,,ctp_C6,trm_4a3fd79d0ae58,the stress and intonation patterns of an utterance. 
353,25411,prosody,,ctp_C6,trm_4a3fd79d0ae64,"the rhythm, stress, and intonation of speech."
354,25412,prospective memory,,ctp_C5,trm_4a3fd79d0ae70,remembering to perform an intended action...prospective memory is self-initiated and does not operate directly on external stimuli.
355,25413,prospective planning,,,trm_4a3fd79d0ae7b,No definition submitted yet
356,25414,prototype,,ctp_C5,trm_4a3fd79d0ae87,"A most common, standard or basic mental representation of some category."
357,25415,quantitative skill,,,trm_4a3fd79d0aeaa,"the ability to to use mathematical concepts to solve problems.  
"
358,25416,reading,,ctp_C6,trm_4a3fd79d0aeb6,Decoding symbols to derive their meaning.
359,25417,reasoning,,ctp_C3,trm_4a3fd79d0aec1,drawing of inferences or conclusions through the use of reason.
360,25418,regret,,ctp_C8,trm_4a3fd79d0aecd,"an emotional response to remembrance of a past state, condition, or experience that one wishes had been different"
361,25419,relational learning,,ctp_C5,trm_4a3fd79d0aed8,"learning to differentiate among stimuli on the basis of relational properties (e.g., the larger of two stimuli) rather than absolute properties (e.g., the stimulus that has a given size)."
362,25420,remote memory,,ctp_C5,trm_4a3fd79d0aee4,memory for events of long ago as opposed to recent events.
363,25421,repressed memory,,ctp_C5,trm_4a3fd79d0aeef,A memory (often traumatic) that is unavailable for recall.
364,25422,resource limit,,ctp_C4,trm_4a3fd79d0af4c,"the maximum amount of cognitive resources that can be allocated to various, often competing tasks"
365,25423,resource sharing,,ctp_C9,trm_4a3fd79d0af5a,"is a unique characteristic of humans and several primates that involve sharing resources such as food, shelter, etc., as a collective risk-reduction against variability in resource supply.
"
366,25424,response inhibition,motor inhibition,ctp_C4,trm_4a3fd79d0af66,Suppression of actions that are inappropriate in a given context and that interfere with goal-driven behavior.
367,25425,response selection,"action selection, motor execution",ctp_C7,trm_4a3fd79d0af71,The selection of one action from a limited set of possible actions.
368,25426,retention,,ctp_C5,trm_4a3fd79d0af7d,"a preservation of the aftereffects of experience and learning that makes recall or recognition possible.
Persistence of learned behavior or experience during a period when it is not being performed o r practiced.
Retention is the second stage of memory after encoding and before retrival"
369,25427,retrieval,,ctp_C5,trm_4a3fd79d0af94,"The process of accessing information from memory or other storage devices; the possibility of recovery, restoration, or rectification.
Retrieval is the third stage of memory after encoding and retention."
370,25428,retrieval cue,,ctp_C5,trm_4a3fd79d0afa0,An event or experience that facilitates retrieval of information from long-term memory because of its association to that information.
371,25429,retroactive interference,retroactive inhibition,ctp_C5,trm_4a3fd79d0afab,impeded retrieval and performance of previously learnt information due to newly acquired and practiced information.
372,25430,rhythm,,ctp_C1,trm_4a3fd79d0afc3,"Movement marked by the regulated succession of strong and weak elements, or of opposite or different conditions.  While rhythm most commonly applies to sound, such as music and spoken language, it may also refer to visual presentation, as timed movement through space."
373,25431,risk,,ctp_C3,trm_4a3fd79d0afcf,"Formally and mathematically speaking, the minimal definition of risk is what (Rothschild and Stiglitz, 1970) call a mean-preserving increase in dispersion. A typical example is a gamble offering $400 or $600 based on the outcome of a coin flip (i.e. with equal probability (50%)); this is less risky as compared to a similar gamble offering $200 or $800 [again depending on the outcome of a coin flip]. Notice here that the mean outcome (or âexpected valueâ) remains the same for both gambles.

Thus risk can increase by keeping both the probabilities and the expected value the same. 

There are other approaches to risk that are less mathematically stringent but have higher ecological validity. For instance increasing the probability of a (positive outcome) is associated with a reduced perception of risk. Notice though now that the expected value (or the mean outcome) also increases. So, it is difficult in that case to disentangle the two metrics.

Many times  the term risk is associated with the probability of a negative outcome, or what is formally called downside risk. This idea is mostly due to the way actuarial science and insurance companies (which are more interested in the negative aspects of risk) use the term. For instance, the statement, ânow we increase the risk,â might be translated as taking more perilous actions, but formally, this is not the case. The point of risk is that the opportunity also increases (âupsideâ risk). Thus, a situation that is riskier can be attractive, especially if the agent focuses on the positive outcomes.

Another approach is the so-called âmoment-basedâ approach. Here, one is interested in the second or higher moments of a distribution, roughly corresponding to variance, skewness and kurtosis. Skewness is of particular interest because it seems that risk-seeking persons (gamblers) can be attracted by positively skewed outcomes. Bets that offer a small probability of a high outcome are  attractive to gamblers (Garrett and Sobel, 1999).

Overall, risk is not a unitary concept and should be very carefully defined.

Note that the term risk as used here should be distinguished from the way the term is used in sentences such as &#34;risk of developing Parkinson&#39;s disease&#34;. An epidemiologist could help on the definition in that context.

Input by other contributors:
the probability or likelihood that an event will occur; possibility of loss or injury; someone or something that creates or suggests a hazard; the chance that an investment will lose value."
374,25432,route knowledge,,,trm_4a3fd79d0afda,is represented as a series of directions to follow to get from one place to another.
375,25433,routine,,,trm_4a3fd79d0afe6,a regular course of procedure; habitual or mechanical performance of an established procedure; a reiterated speech or formula; a sequence of computer instructions for performing a particular task.
376,25434,rule,,,trm_4a3fd79d0aff2,a method for performing a psychological operation
377,25435,rule learning,,ctp_C5,trm_4a3fd79d0affd,"process in which a participant gradually acquires knowledge about a fixed but unstated standard that defines, for example, the acceptability of a response or membership of category"
378,25436,sadness,,ctp_C8,trm_4a3fd79d0b014,"an emotion  characterized by feelings of unhappiness, disadvantage, loss, and helplessness."
379,25437,salience,,,trm_4a3fd79d0b020,a parameter of a stimulus that indexes its effectiveness.
380,25438,schema,,ctp_C3,trm_4a3fd79d0b02c,a structured representation that includes a particular organized way of perceiving and responding to a complex situation or set of stimuli.
381,25439,search,,ctp_C2,trm_4a3fd79d0b037,"to look into or over carefully or thoroughly in an effort to find or discover something; to look through or explore by inspecting possible places of concealment or investigating suspicious circumstances; to look at as if to discover or penetrate intention or nature; to uncover, find, or come to know by inquiry or scrutiny."
382,25440,selective attention,"controlled attention, directed attention",ctp_C2,trm_4a3fd79d0b043,"When multiple external sensory inputs are present, the process of dedicating cognitive and perceptual resources to one type/set of input and attenuating receptiveness to other inputs."
383,25441,self monitoring,,ctp_C4,trm_4a3fd79d0b05e,monitoring of one&#39;s own behavior.
384,25442,semantic category,,ctp_C6,trm_4a3fd79d0b06b,"is a grouping of vocabulary within a language, organizing words which are interrelated and define each other in various ways. Also referred to as a semantic field.

"
385,25443,semantic knowledge,,ctp_C6,trm_4a3fd79d0b077,"long-established knowledge about objects, facts, and word meanings."
386,25444,semantic memory,,ctp_C6,trm_4a3fd79d0b083,"refers to one&#39;s conceptual knowledge and includes the meanings of words, factual information about the world, and other information not related to specific events or episodes"
387,25445,semantic working memory,,ctp_C4,trm_4a3fd79d0b08f,Working memory for meaning
388,25446,sensory memory,sensory-information store; sensory register,ctp_C5,trm_4a3fd79d0b09a,"brief storage of sensory information in each of the senses, which temporarily holds material (e.g., a perceptual experience) for recoding into another memory (such as short-term memory) or for comprehension."
389,25447,sequence learning,,ctp_C5,trm_4a3fd79d0b0a6,learning of a sequence of items or responses in the precise order of their presentation.
390,25448,serial learning,,ctp_C5,trm_4a3fd79d0b0b1,The process of acquiring information in sequence and following an order that must be preserved at recall.
391,25449,serial processing,"intermittent processing, sequential processing",,trm_4a3fd79d0b0bd,information processing in which only one sequence of processing operations is carried on at a time.
