,node_id,name,condition_text,prop_id,condition_description
350,24729,standard,standard,con_50071a37b1d5d,participants are shown an 8.5&#34;x11&#34; sheet of paper with a 15cm x 10cm array of numbers and are instructed to cross out specific numbers
351,24730,distraction,distraction,con_50071a8868d23,like standard except that participants are to ignore numbers being read aloud at a rate of 1/s through earphones while completing the task
352,24731,valid,valid,con_5007214ea57b0,probe is preceded by specified cue
353,24732,invalid,invalid,con_50072163abcd6,probe is preceded by non-specified cue
354,24733,control,control,con_5007230227b63,each task performed individually
355,24734,dual,dual,con_5007231499001,tasks performed simultaneously
356,24735,experimental,experimental,con_500ed40dee3f2,a distractor from the prime trial is the target in the test trial
357,24736,control,control,con_500ed43a992dc,neither targets nor distractors are repeated across trials
358,24737,1 syllable,1 syllable,con_500edb7bb2eba,None
359,24738,2 syllables,2 syllables,con_500edb831bf11,None
360,24739,3 syllables,3 syllables,con_500edb89d30bb,None
361,24740,4 syllables,4 syllables,con_500edba4a9d54,None
362,24741,Arabic,Arabic,con_500f1c07cfd4d,numberals are represented in the Arabic system
363,24742,verbal,verbal,con_500f1c258ac99,numerals are represented as words 
364,24743,wordlike,wordlike,con_500f2884d0343,nonwords more closely resemble real words
365,24744,less wordlike,less wordlike,con_500f28a8b2663,nonwords less closely resemble real words
366,24745,congruent,congruent,con_5016d64fde9f0,name matches drawing
367,24746,incongruent,incongruent,con_5016d65d3d127,name does not match drawing
368,24747,time-based,time-based,con_5016ec35ef530,remembering to perform task in specified intervals
369,24748,event-based,event-based,con_5016ec5405d68,remembering to perform task after a specified event
370,24749,high importance,high importance,con_5016ec67d0741,task described as more important than alternative task
371,24750,low importance,low importance,con_5016ecccbb23a,task described as less important than alternative task
372,24751,normal,normal,con_5016ed2c51295,participant is only given prospective memory tasks
373,24752,demanding,demanding,con_5016ed5b9d173,participant performs prospective memory task and a competing task (e.g. listening for a digit named in an auditory stream)
374,24753,related,related,con_50183cc26e109,prime is related to target
375,24754,unrelated,unrelated,con_50183cd33de35,prime is unrelated to target
376,24755,identical,identical,con_50183ce33eec5,prime is identical to target
377,24756,unprimed,unprimed,con_50183e7dbc0ec,only target is presented
378,24757,target infrequent,target infrequent,con_501859fc9af83,"the first half of the test, in which the target:nontarget ratio is 1:3.5"
379,24758,target frequent,target frequent,con_50185a2f8cbc5,"the second half of the test, in which the target:nontarget ratio is 3.5:1"
380,24759,amnesic,amnesic,con_502014153aa0b,participants have severely impaired declarative memory
381,24760,walker,walker,con_50203ad19317b,points of light move at a rate and in a direction generated by an algorithm approximating human walking
382,24761,scrambled walker,scrambled walker,con_50203b19cc8ea,"point of light mirror the direction and speed of walker points, but their x or y coordinates are randomly shifted"
383,24762,control,control,con_5022f1292501d,participant performs engages in an analogous activity
384,24763,positive reinforcement,positive reinforcement,con_50240f36c3eb2,behavior is followed by grant of a rewarding stimulus
385,24764,negative reinforcement,negative reinforcement,con_50240f820328f,behavior is followed by removal of an aversive stimulus
386,24765,positive punishment,positive punishment,con_50240fc4ca92e,behavior is followed by grant of an aversive stimulus
387,24766,negative punishment,negative punishment,con_50240fdd1ff57,behavior is followed by removal of a rewarding stimulus
388,24767,N (neutral),N (neutral),con_50242136e2a98,no aversive stimulus presented
389,24768,P (predictable),P (predictable),con_5024215793bcc,aversive stimulus only presented after a specific cue
390,24769,U (unpredictable),U (unpredictable),con_5024217433505,aversive stimulus presented without relationship to cue
391,24770,cued,cued,con_50242249c5047,"segment within a given trial (either N, P, or U) during which cue is present"
392,24771,uncued,uncued,con_502422595ada7,"segment within a given trial (either N, P, or U) during which cue is absent"
393,24772,subitizing,subitizing,con_50295964c90b4,"the number of items to be counted is below a threshold above which participants must actively count, typically less than 4"
394,24773,counting,counting,con_502959925374c,"the number of items is past a certain threshold beyond which participants must actively count, typically >4"
395,24774,low load,low load,con_50295b35edd59,items to be counted are appraised for one feature (e.g. color or arrangement)
396,24775,high load,high load,con_50295b3ccdd3d,items to be counted are appraised for more than one feature (e.g. color and arrangement)
397,24776,method of limits,method of limits,con_502985c73076c,None
398,24777,staircase method,staircase method,con_502985cece499,None
399,24778,random,random,con_502a99f58d5d3,some proportion of dots is moving in a particular motion while the rest move randomly
400,24779,,None,con_502a9a6a70396,dots other than those in target array move in a specific direction
401,24780,operation span,operation span,con_504ca95bcec8c,Presentation of mathematical verification followed by word
402,24781,sleep deprived,sleep deprived,con_50b55df0387fb,the subjects have not had adequate sleep for one or more nights
403,24782,controls,controls,con_50b55e45ba1cb,the subjects get adequate sleep or have not undergone neurobehavioral change
404,24783,congruent,congruent,con_50b66686e34f2,the associations are congruent with the participant&#39;s beliefs (i.e. negative words are associated with obesity when the participant has an implicit bias against the obese)
405,24784,incongruent,incongruent,con_50b666a40f0c3,the associations are incongruent with the participant&#39;s beliefs (i.e. positive words are associated with obesity when the participant has an implicit bias against the obese)
406,24785,threat-congruent,threat-congruent,con_50df0bc1ce0ae,trials where a threat stimulus appears in the same spatial location as a probe
407,24786,threat-incongruent,threat-incongruent,con_50df0bed9919f,trial where a threat appears on the opposite spatial hemi-field as a probe
408,24787,reward-congruent,reward-congruent,con_50df0c0a20ea1,trials where a positive-valence stimulus appears in the same sptial location as a probe
409,24788,reward-incongruent,reward-incongruent,con_50df0c24926ec,trials where a positive stimulus appears on the opposite spatial hemi-field as a probe
410,24789,neutral,neutral,con_50df0c3a6aa52,trials where a probe follows two identical neutral stimuli
411,24790,Valid HC-Hit Cue,Valid HC-Hit Cue,con_50df0eb2562c4,valid cue where following object was a subsequent high confidence hit
412,24791,Valid HC-Hit Obj,Valid HC-Hit Obj,con_50df0ed536d9d,object that was a subsequent high confidence hit and that followed a valid cue
413,24792,Valid LC-Hit Cue,Valid LC-Hit Cue,con_50df0eeeee5b6,valid cue where following object was a subsequent low confidence hit
414,24793,Valid LC-Hit Obj,Valid LC-Hit Obj,con_50df0f098f736,object that was a subsequent low confidence hit and that followed a valid cue
415,24794,Valid Miss Cue,Valid Miss Cue,con_50df0f215cb96,valid cue where following object was a subsequent miss
416,24795,Valid Miss Obj,Valid Miss Obj,con_50df0f36c245d,object that was a subsequent miss and that followed a valid cue
417,24796,Invalid HC-Hit Cue,Invalid HC-Hit Cue,con_50df0f4e0b601,invalid cue where following object was a subsequent high confidence hit
418,24797,Invalid HC-Hit Obj,Invalid HC-Hit Obj,con_50df0f64eaf31,object that was a subsequent high confidence hit and that followed an invalid cue
419,24798,Invalid LC-Hit Cue,Invalid LC-Hit Cue,con_50df0f7c63c57,invalid cue where following object was a subsequent low confidence hit
420,24799,Invalid LC-Hit Obj,Invalid LC-Hit Obj,con_50df0f9232e1f,object that was a subsequent low confidence hit and that followed an invalid cue
421,24800,Invalid Miss Cue,Invalid Miss Cue,con_50df0fa9cc5ad,invalid cue where following object was a subsequent miss
422,24801,Invalid Miss Obj,Invalid Miss Obj,con_50df0fbf22cb6,object that was a subsequent miss and that followed an invalid cue
423,24802,Valid Other Obj Cue,Valid Other Obj Cue,con_50df0fe14a329,valid cue where following stimulus was an untested or no response object
424,24803,Valid Other Obj,Valid Other Obj,con_50df0ff82e373,stimulus that was an untested or no response object and that followed a valid cue
425,24804,Valid Other Greeble Cue,Valid Other Greeble Cue,con_50df10153b7bf,valid cue where following stimulus was an untested or no response greeble
426,24805,Valid Other Greeble,Valid Other Greeble,con_50df102bc3458,stimulus that was an untested or no response greeble and that followed a valid cue
427,24806,Invalid Other Greeble Cue,Invalid Other Greeble Cue,con_50df10401ea84,invalid cue where following stimulus was an untested or no response greeble
428,24807,Invalid Other Greeble,Invalid Other Greeble,con_50df10598b840,stimulus that was an untested or no response greeble and that followed a invalid cue
429,24808,Look Neutral Cue,Look Neutral Cue,con_50df74ef610eb,participant views a cue that signals to look at a neutral image
430,24809,Look Negative Cue,Look Negative Cue,con_50df751810f05,participant views a cue that signals to look at an aversive image
431,24810,Reappraise Negative Cue,Reappraise Negative Cue,con_50df756e1d33c,participant looks at a cue that signals to reappraise an aversive image
432,24811,look Neutral Stimulus,look Neutral Stimulus,con_50df7707af0bb,participant views a neutral image
433,24812,Look Negative Stimulus,Look Negative Stimulus,con_50df7733cfb90,participant views an aversive image
434,24813,Reappraise Negative Stimulus,Reappraise Negative Stimulus,con_50df77948b9ad,participant reappraises the emotional value of an aversive image so the emotional impact is less negative
435,24814,Look Neutral Rating,Look Neutral Rating,con_50df78c4dd566,participants rate their negative affect after a neutral stimulus
436,24815,Look Negative Rating,Look Negative Rating,con_50df792ceb48a,participants rate their negative affect after an aversive stimulus
437,24816,Reappraise Negative Rating,Reappraise Negative Rating,con_50df797fd16fc,participants rate their negative affect after they were asked to reappraise an aversive image
438,24817,Look Neutral Anticipation,Look Neutral Anticipation,con_50df7da4c458d,anticipation trial that involves viewing a neutral cue without a neutral stimulus following the cue
439,24818,Look Negative Anticipation,Look Negative Anticipation,con_50df7dc9acea8,anticipation trial that involves viewing a negative cue without a aversive stimulus following the cue
440,24819,Reappraise Negative Anticipation,Reappraise Negative Anticipation,con_50df7e2f7195c,anticipation trial that involves viewing a reappraisal cue without the aversive image appearing after the cue
441,24820,control,control,con_50eb0a8e319e8,No background noise is heard; only the voice the participant is asked to repeat is audible.
442,24821,word in noise,word in noise,con_50eb0acb0b7d8,"Noise, such as other voices conversing, is heard in the background, and the participant must discriminate the voice."
443,24822,age,age,con_50eb0eb594ef3,this task is often administered at multiple time points to determine improvement
444,24823,Single dimension,Single dimension,con_50eb12042553f,"participants must match pictures based on one dimension (color, shape, type, size)"
445,24824,Switch dimensions,Switch dimensions,con_50eb123d568c0,"participants must match pictures based on one dimension (color, shape, type, size), then switch to another. This may be repeated multiple times in one trial. "
446,24825,1-List,1-List,con_50eb176d80cd0,participants repeat items according to only one dimension
447,24826,2-List,2-List,con_50eb17830016a,participants repeat items according to two dimensions
448,24827,left hand,left hand,con_50eb4dabf217b,participant uses only the left hand to place and remove pegs
449,24828,right hand,right hand,con_50eb4dbe3ac59,participant uses only the right hand to place and remove pegs
450,24829,left hand,left hand,con_50eb52b61eb0c,participant uses only the left hand to squeeze dynamometer
451,24830,right hand,right hand,con_50eb52c6989fd,participant uses only the right hand to squeeze dynamometer
452,24831,eyes open on solid surface,eyes open on solid surface,con_50eb55490a80d,None
453,24832,eyes closed on a solid surface,eyes closed on a solid surface,con_50eb55559d7fc,None
454,24833,eyes open on a foam surface,eyes open on a foam surface,con_50eb55639098e,None
455,24834,eyes closed on a foam surface,eyes closed on a foam surface,con_50eb556ec4c57,None
456,24835,eyes open in tandem stance on a solid surface,eyes open in tandem stance on a solid surface,con_50eb558569fa5,None
457,24836,right ear,right ear,con_50f37535cf238,None
458,24837,left ear,left ear,con_50f3753fcc0b8,None
459,24838,still,still,con_50f3818945a77,participant does not move their head or body during the task
460,24839,suppression,suppression,con_50f582ae00bbe,the subject must produce irrelevant speech during maintenance
461,24840,control,control,con_50f582c38ea5f,the subject must maintain information without production)
462,24841,control,control,con_50f7373e452f1,the participant completes the task in what they would consider their normal state (naive to alterations by the experimenters)
463,24842,subjective state,subjective state,con_50f7379834a1c,"the participant completes the task after an alteration to their subjective state has been made by the researchers (drug administered, a specific emotion elicited, etc.)"
464,24843,fixed win,fixed win,con_50f73d738249e, subject is awarded 100 points for a correct decision regardless of the number of boxes opened
465,24844,decreasing win,decreasing win,con_50f73d891f5be,number of points that can be won for a correct decision starts at 250 and decreases by 10 points for every box touched
466,24845,false belief story,false belief story,con_50f8708de32a9,participants listen to a false belief story
467,24846,false belief question,false belief question,con_50f870b8eb8cc,participants answer a question about the false belief story
468,24847,false belief picture story,false belief picture story,con_50f8712146b18,participants look at a physical representation of a false belief story
469,24848,false belief picture question,false belief picture question,con_50f871f68ae7a,participants answer a question about a picture of a false belief story
470,24849,Immediate,Immediate,con_50f9997f676f2,Participant is shown list immediately after learning target words
471,24850,Delayed,Delayed,con_50f999958552e,Participant is shown list 20 minutes after learning target words
472,24851,forward,forward,con_5106ef0dbbd61,the subject is given a set of numbers and asked to repeat them in the order given.
473,24852,backward,backward,con_5106ef2710e26,the subject is given a set of numbers and asked to repeat them in the opposite of the order given.
474,24853,sequencing,sequencing,con_5106ef40748b3,the subject is given a set of numbers and asked to list them in ascending order from smallest to largest.
475,24854,line criterion rule,line criterion rule,con_512e7df3f05ad,size of criterion line used for classifying stimuli
476,24855,size of line,size of line,con_512e7ed7dffc2,size of line stimulus presented on each trial
477,24856,line trial,line trial,con_512e7f07caf9d,trials with responses
478,24857,criterion rule,criterion rule,con_512e803a93e35,size of dot matrix(number of dots in dot matrix) used for classifying stimuli
479,24858,number of dots,number of dots,con_512e80b39668f,number of dots in dot matrix presented on each trial
480,24859,response time,response time,con_512e80e2a1e29,response time to dot stimuli
481,24860,trial,trial,con_512e816e6aa77,trials with responses
482,24861,Rating - Parametric,Rating - Parametric,con_5176d7e488bb9,Parametric modulation by rating
483,24862,dot criterion rule,dot criterion rule,con_512e8f483ae6a,size of dot matrix(number of dots in dot matrix) used for classifying stimuli
484,24863,number of dots,number of dots,con_512e8f98ce8e7,number of dots in dot matrix presented on each trial
485,24864,Rating,Rating,con_5176d7bee856e,Rating of affect across all conditions
486,24865,dot trial,dot trial,con_512e8fccc0954,trials with responses
487,24866,correct trial,correct trial,con_512e904eb351d,correct responses on line and dot stimuli trials
488,24867,error trial,error trial,con_512e906c50035,error trials on line and dot stimuli trials
489,24868,nontarget,nontarget,con_51537e91130e4,playing Space Fortress
490,24869,target,target,con_51537e897f2e7,simultaneously playing Space Fortress and performing an oddball task
491,24870,accept,accept,con_514a09160dc6c,trials accepted
492,24871,reject,reject,con_514a092211043,trials rejected
493,24872,change,change,con_51549090cc831,the second array contains a different item than the original
494,24873,no change,no change,con_515490a7787af,the second array is identical to the original
495,24874,Target,Target,con_5154969d504f7,the dot pattern matches the pattern that the subject is told to respond to
496,24875,Non-target,Non-target,con_515496b2797ae,the dot pattern differs from the intended target pattern
497,24876,Mirror-Switch,Mirror-Switch,con_5176cff54add4,Mirror-reversed trials preceded by a plain text trial
498,24877,Mirror-Repeat,Mirror-Repeat,con_5176d0097cac2,Mirror-reversed trials preceded by a mirror-reversed trial
499,24878,Plain-Switch,Plain-Switch,con_5176d01c424d9,Plain-text trials preceded by a mirror-reversed trial
500,24879,Plain-Repeat,Plain-Repeat,con_5176d02ddd1b0,Plain-text trials preceded by a plain-text trial
501,24880,Easy trials,Easy trials,con_5176d87fe1c3b,Trials in which the difference in value between options is large
502,24881,Hard trials,Hard trials,con_5176d88d48168,Trials in which the difference in value between options is small
503,24882,Easy - parametric,Easy - parametric,con_5176d8b1e4bf2,Parametric modulation by distance from indifference
504,24883,Hard - parametric,Hard - parametric,con_5176d8bb1aa49,Parametric modulation by distance from indifference
505,24884,line trial response time,line trial response time,con_5181f0ebe7145,response time for line trials
506,24885,dot trial response time,dot trial response time,con_5181f1086cf68,response time for dot trials
507,24886,measure of difficulty,measure of difficulty,con_5181f12f2e43a,where a higher number means greater difficulty
508,24887,pumps_fixed,pumps_fixed,con_5181f47468c45,average activity across all pumps with fixed duration and without parametric modulation
509,24888,pumps_demean,pumps_demean,con_5181f4b083b11,parametrically modulated activity by the demeaned number of pumps (linearly increasing) within each trial and with fixed duration
510,24889,pumps_fixed_real_RT,pumps_fixed_real_RT,con_5181f4e07430c,average activity across all pumps with duration of pumps set to actual RT of each pump
511,24890,cash_fixed,cash_fixed,con_5181f506e4391,average activity across all pumps on cash-out events with fixed duration and without parametric modulation
512,24891,cash_demean,cash_demean,con_5181f53313a76,parametrically modulated activity by the demeaned number of pumps on cash-out events (linearly increasing) within each trial and with fixed duration
513,24892,cash_fixed_real_RT,cash_fixed_real_RT,con_5181f559c92c9,average activity across all pumps on cash-out event with duration of pumps set to actual RT of each pump
514,24893,explode_fixed,explode_fixed,con_5181f5808ea93,average activity across all pumps on explosion events with fixed duration and without parametric modulation
515,24894,explode_demean,explode_demean,con_5181f5a480b56,parametrically modulated activity by the demeaned number of pumps on explosion events (linearly increasing) within each trial and with fixed duration
516,24895,control_pumps_fixed,control_pumps_fixed,con_5181f5ce21189,average activity across all pumps on control balloons with fixed duration and without parametric modulation
517,24896,control_pumps_demean,control_pumps_demean,con_5181f5f6e6f8b,parametrically modulated activity by the demeaned number of pumps on control balloons (linearly increasing) within each trial and with fixed duration
518,24897,control_pumps_fixed_real_RT,control_pumps_fixed_real_RT,con_5181f624a380b,average activity across all pumps on control balloon with duration of pumps set to actual RT of each pump
519,24898,probabilistic classification trials,probabilistic classification trials,con_5181f6ea8c76f,None
520,24899,deterministic classification trials,deterministic classification trials,con_5181f702d67cd,None
521,24900,parametric gain,parametric gain,con_5181f7678014f,None
522,24901,parametric loss,parametric loss,con_5181f7727d7e4,None
523,24902,distance from indifference,distance from indifference,con_5181f78292b39,None
524,24903,Go trial,Go trial,con_5181f83b8e5d0,Trials on which a go stimulus is presented and the subject is expected to respond
525,24904,Stop trial,Stop trial,con_5181f83b8e70e,"Trials on which a stop signal is presented at some delay (stop-signal delay) following the go stimulus, and the subject is expected to stop"
526,24905,Successful Stop Trial,Successful Stop Trial,con_5181f83b8e7c1,"A trial on which a stop signal is presented at a delay following the go stimulus, and the subject successfully withholds their response"
527,24906,Unsuccessful stop trial,Unsuccessful stop trial,con_5181f83b8e875,"A trial on which a stop signal is presented at a delay following the go stimulus, and the subject fails to withhold their response"
528,24907,Junk trial,Junk trial,con_5181f83b8e920,A go trial on which subject failed to respond or responded incorrectly
529,24908,Go trial,Go trial,con_5181f863d4de3,Trials on which a go stimulus is presented and the subject is expected to respond
530,24909,Stop trial,Stop trial,con_5181f863d4ecc,"Trials on which a stop signal is presented at some delay (stop-signal delay) following the go stimulus, and the subject is expected to stop"
531,24910,Successful Stop Trial,Successful Stop Trial,con_5181f863d4f88,"A trial on which a stop signal is presented at a delay following the go stimulus, and the subject successfully withholds their response"
532,24911,Unsuccessful stop trial,Unsuccessful stop trial,con_5181f863d5046,"A trial on which a stop signal is presented at a delay following the go stimulus, and the subject fails to withhold their response"
533,24912,Junk trial,Junk trial,con_5181f863d50f9,A go trial on which subject failed to respond or responded incorrectly
534,24913,correct classification of dual-task items,correct classification of dual-task items,con_5181fa1e66a37,None
535,24914,positive feedback,positive feedback,con_5181faac8b631,trials when subject received positive feedback
536,24915,negative feedback,negative feedback,con_5181fac688ec9,trials when subject received negative feedback
537,24916,classification learning trials,classification learning trials,con_5181fb7c1b32b,trials on which the subject classifies items
538,24917,Probe,Probe,con_5181fb7c1b42a,Probe asking which of two numbers is higher
539,24918,positive feedback,positive feedback,con_5181fb7c1b4c2,trials when subject received positive feedback
540,24919,negative feedback,negative feedback,con_5181fb7c1b543,trials when subject received negative feedback
541,24920,words,words,con_5181fc76c54d1,None
542,24921,consonant strings,consonant strings,con_5181fc87a2444,None
543,24922,task,task,con_518c28192f54f,None
544,24923,successful stop - critical,successful stop - critical,con_518c2b07f10de,trials when subjects successfully completed a stop - critical trial
545,24924,Cue: central,Cue: central,con_52df9fcd93042,cue precedes trial but no provides information about the location of the upcoming stimulus
546,24925,Repetition,Repetition,con_5346920ceb308,Repetition of words
547,24926,Generation,Generation,con_534692923de0a,Covert generation of verbs
548,24927,Finger,Finger,con_5346930c6e0be,Tap index finger in response to a picture of a finger
549,24928,Foot,Foot,con_5346931aab88a,Flex foot in response to picture of a foot
550,24929,Lips,Lips,con_5346932bab789,Purse lips in response to picture of lips
551,24930,Landmark,Landmark,con_534693b9b6973,Decide whether a line is crossed in the middle
552,24931,Detection,Detection,con_534693c651f43,Decide whether a line is crossed at all
553,24932,0-back faces,0-back faces,con_550b515f779fa,blocked
554,24933,0-back places,0-back places,con_550b516d4cacf,blocked
555,24934,0-back tools,0-back tools,con_550b517bd07c4,blocked
556,24935,0-back body parts,0-back body parts,con_550b51862472e,blocked
557,24936,2-back faces,2-back faces,con_550b51949b7df,blocked
558,24937,2-back places,2-back places,con_550b519cf0ebb,blocked
559,24938,2-back tools,2-back tools,con_550b51a7c499c,blocked
560,24939,2-back body parts,2-back body parts,con_550b51b041eed,blocked
561,24940,0-back correct trials,0-back correct trials,con_550b524533150,event-related
562,24941,0-back error trials,0-back error trials,con_550b52534532d,event-related
563,24942,0-back no response trials,0-back no response trials,con_550b525f91901,event-related
564,24943,2-back correct trials,2-back correct trials,con_550b526c7b603,event-related
565,24944,2-back error trials,2-back error trials,con_550b52788b465,event-related
566,24945,2-back no response trials,2-back no response trials,con_550b52861724b,event-related
567,24946,Left finger blocks,Left finger blocks,con_550b540d2ea96,None
